ReviewId,ProductName,Review,Sentiment
386,iphone,touch screen is good,POSITIVE
387,iphone,songs cannot be downloaded but itunes are used,NEUTRAL
388,HTC,high battery consumption not long lasting,NEGATIVE
389,windows,highly recommended and better mobile than other,POSITIVE
390,iphone,not user friendly,NEGATIVE
391,htc,not easy to  handle,NEGATIVE
392,iphone,captures VERY GOOD LIVE PICTURES,POSITIVE
393,HTC,high resolution camera gives good photos,POSITIVE
394,windows,long lasting battery is a good feature,POSITIVE
395,iphone,good sync with other apps,POSITIVE
396,HTC,call connections are not working properly,NEGATIVE
397,HTC,external storage is upto 128gb is very good,POSITIVE
398,iphone,apple branded new red iphones that are pretty good,POSITIVE
399,windows,no problem with major apps but difficult to access,NEUTRAL
400,iphone,less weight than other mobiles that is the best,POSITIVE
401,iphone,no issues but home button for all generation mobiles,NEUTRAL
402,windows,not having dual sim feature,NEGATIVE
403,windows,good processor  gives good performance,POSITIVE
404,HTC,speakers are okay but design maybe better,NEUTRAL
405,HTC,frequestly restarting can not be used for major work,NEGATIVE
406,IPHONE,highly good voice recognition,POSITIVE
407,htc,bad battery power,NEGATIVE
408,windows,nice model design,POSITIVE
409,windows,good mobile but issues with various apps,NEUTRAL
410,windows,datas lost once cannot be retrieved,NEGATIVE
411,iphone,not happy with the model,NEGATIVE
412,iphone,lot of best enhanced features,POSITIVE
413,iphone,good apps but not easily used,NEUTRAL
414,windows,good camera ,POSITIVE
415,HTC,rear camera is good but front camera would also be good,NEUTRAL
416,windows,highly reliable that is majorly good,POSITIVE
417,windows,secured but lot of procedures,NEUTRAL
418,htc,pretty cool to access but display resoluthion may be better,NEUTRAL
419,htc,htc branded as a good mobile with better UI,POSITIVE
420,windows,model is very good and branded,POSITIVE
421,windows,can not easily handle,NEGATIVE
422,windows,too difficult to use but highly secured,NEUTRAL
423,htc,sync issues  but no any other problems ,NEUTRAL
424,htc,very bad storage,NEGATIVE
425,iphone,volume facilties are there but stereo can be better,NEUTRAL
426,htc,dolby atmos for music is nice,POSITIVE
427,iphone,uneducated cannot easy to use,NEGATIVE
428,iphone,provides many features and many constraints is included that is not easy,NEGATIVE
429,htc,multiple window feature is not implemented,NEGATIVE
430,iphone,data connection is good but wifi is needed,NEUTRAL
431,windows,phone may hung up due to to overheat this cannot be rectified,NEGATIVE
432,windows,facinating good wallpaper features,POSITIVE
433,HTC,better audio features,POSITIVE
434,iphone,data connectivity is highly good,POSITIVE
435,iphone,battery not lasting upto evening,NEGATIVE
436,htc,data connectivity is very low if we do not use 4g ,NEGATIVE
437,windows,not a good phone do not buy this,NEGATIVE
438,htc,good enhancements but not worth it,NEUTRAL
439,HTC,sync issues that is not easily rectified,NEGATIVE
440,windows,best background features,POSITIVE
441,Iphone,very good mobile for buisness,POSITIVE
442,htc,mobile is easy to handle that is good,POSITIVE
443,windows,good help and support fro the team,POSITIVE
444,iphone,best graphics for games,POSITIVE
445,windows,easily battery drains not long lasting,NEGATIVE
446,iphone,not easy to use because of highly enhanced features,NEGATIVE
447,htc,not as per the specification,NEGATIVE
448,windows,features are good but small problems are there,NEUTRAL
449,htc,no sync issues but account is needed,NEUTRAL
450,windows,model is good but no enhanced features,NEUTRAL
451,iphone,worst price rate,negative
452,htc,worst specification,negative
453,windows,worst os,negative
454,iphone,worst phone at this price,negative
455,windows,i dont want to buy windows phone again,negative
456,iphone,worst battery life,negative
457,windows,worst phone ever,negative
458,htc,worst phone ever,negative
459,iphone,worst phone ever,negative
460,iphone,best interface,positive
461,window,best battery backup but not good interface,neutral
462,htc,good design but can be cheaper,neutral
463,iphone,best phone but too costly,neutral
464,windows,should improve,neutral
465,iphone,worst,negative
466,windows,worst,negative
467,htc,worst,negative
